{
  "schema": "siembox.parser/v1",
  "name": "nginx-proxy-manager-access",
  "description": "Parses NGINX Proxy Manager access logs for web traffic monitoring and attack detection",
  "parser_type": "regex",
  "priority": 50,
  "pattern": "^(?<client_ip>[\\d.]+)\\s+-\\s+(?<remote_user>\\S+)\\s+\\[(?<timestamp>[^\\]]+)\\]\\s+\"(?<method>\\w+)\\s+(?<request_uri>\\S+)\\s+HTTP/(?<http_version>[\\d.]+)\"\\s+(?<status_code>\\d{3})\\s+(?<body_bytes_sent>\\d+)\\s+\"(?<http_referer>[^\"]*)\"\\s+\"(?<user_agent>[^\"]*)\"",
  "field_mappings": {
    "client_ip": "client_ip",
    "remote_user": "remote_user",
    "timestamp": "timestamp",
    "method": "method",
    "request_uri": "request_uri",
    "http_version": "http_version",
    "status_code": "status_code",
    "body_bytes_sent": "body_bytes_sent",
    "http_referer": "http_referer",
    "user_agent": "user_agent",
    "service": "nginx-proxy-manager"
  },
  "event_type": "http_request",
  "enabled": true,
  "test_samples": [
    {
      "description": "authenticated proxied request returning 200",
      "input": "203.0.113.5 - admin [15/Jan/2024:12:00:00 +0000] \"GET /api/users HTTP/2.0\" 200 532 \"https://npm.example.com/\" \"Mozilla/5.0\"",
      "expect": {
        "client_ip": "203.0.113.5",
        "source_ip": "203.0.113.5",
        "user": "admin",
        "method": "GET",
        "path": "/api/users",
        "status_code": "200",
        "user_agent": "Mozilla/5.0"
      }
    },
    {
      "description": "anonymous 403 to a sensitive path",
      "input": "198.51.100.9 - - [15/Jan/2024:12:01:00 +0000] \"GET /.git/config HTTP/1.1\" 403 153 \"-\" \"python-requests/2.31.0\"",
      "expect": {
        "client_ip": "198.51.100.9",
        "source_ip": "198.51.100.9",
        "method": "GET",
        "path": "/.git/config",
        "status_code": "403",
        "user_agent": "python-requests/2.31.0"
      }
    }
  ],
  "metadata": {
    "author": "siembox",
    "log_source": "NGINX Proxy Manager proxy-host access log (combined format)",
    "tags": [
      "http",
      "reverse-proxy",
      "nginx",
      "nginx-proxy-manager"
    ],
    "references": [
      "https://nginxproxymanager.com/"
    ]
  }
}
