{
  "schema": "siembox.parser/v1",
  "name": "ubiquiti-unifi-ids-ips",
  "parser_type": "regex",
  "pattern": "^(?:(?<syslog_time>\\w{3} {1,2}\\d{1,2} [\\d:]{7,8}) (?<syslog_host>\\S{1,64}) )?CEF:(?<cef_version>\\d{1,3})\\|(?<cef_vendor>[^|]{0,64})\\|(?<cef_product>[^|]{0,64})\\|(?<cef_product_version>[^|]{0,64})\\|(?<cef_sig_id>[^|]{0,64})\\|(?<cef_name>[^|]{0,128})\\|(?<cef_severity>[^|]{0,16})\\|(?<extension>UNIFIcategory=Security .*)$",
  "field_mappings": {
    "syslog_host": "host",
    "cef_name": "event",
    "cef_severity": "severity_label",
    "extension": "extension"
  },
  "description": "Parses UniFi Network IDS/IPS threat events shipped as CEF over syslog. The regex captures only the CEF envelope (linear, ReDoS-safe); the engine's CEF extension parser explodes the key=value pairs (handling unquoted spaces in values such as signature names), and derivations map them to canonical fields. The syslog time/host prefix is optional so the header-stripped message SIEMBox stores also matches. Requires the extension to start with UNIFIcategory=Security (the discriminator vs. the audit parser).",
  "priority": 200,
  "derivations": [
    {
      "extract": {
        "action": {
          "from": "act",
          "pattern": "^([\\s\\S]+)$"
        },
        "service": {
          "from": "app",
          "pattern": "^([\\s\\S]+)$"
        },
        "message": {
          "from": "msg",
          "pattern": "^([\\s\\S]+)$"
        },
        "network_protocol": {
          "from": "proto",
          "pattern": "^([\\s\\S]+)$"
        },
        "sensor_ip": {
          "from": "UNIFIdeviceIp",
          "pattern": "^([\\s\\S]+)$"
        },
        "network_direction": {
          "from": "UNIFIdirection",
          "pattern": "^([\\s\\S]+)$"
        },
        "signature_id": {
          "from": "UNIFIipsSignatureId",
          "pattern": "^([\\s\\S]+)$"
        },
        "rule_name": {
          "from": "UNIFIpolicyName",
          "pattern": "^([\\s\\S]+)$"
        },
        "rule_type": {
          "from": "UNIFIpolicyType",
          "pattern": "^([\\s\\S]+)$"
        },
        "signature_name": {
          "from": "UNIFIipsSignature",
          "pattern": "^([\\s\\S]+)$"
        }
      },
      "overwrite": true
    },
    {
      "set": {
        "event_outcome": "blocked"
      },
      "when": {
        "action": {
          "equals": "blocked"
        }
      }
    },
    {
      "set": {
        "event_outcome": "allowed"
      },
      "when": {
        "action": {
          "equals": "allowed"
        }
      }
    }
  ],
  "event_type": "ids_ips_alert",
  "enabled": true,
  "test_samples": [
    {
      "input": "Jun 24 15:22:05 UCG-Max CEF:0|Ubiquiti|UniFi Network|10.4.57|201|Threat Detected and Blocked|7|UNIFIcategory=Security UNIFIhost=UCG Max proto=TCP spt=37383 dpt=443 act=blocked app=HTTPS UNIFIrisk=medium UNIFIpolicyName=DShield Block List UNIFIpolicyType=IDS/IPS UNIFIdirection=incoming deviceOutboundInterface=Default UNIFIdeviceMac=28:70:4e:84:bc:d5 UNIFIdeviceName=UCG Max UNIFIdeviceModel=UCG-Max UNIFIdeviceIp=192.168.1.1 UNIFIdeviceVersion=5.1.19 src=45.194.67.146 dst=192.168.1.194 UNIFIsrcRegion=BR UNIFIdstZone=Internal UNIFItotalBytes=54 UNIFItotalPackets=1 UNIFIpacketsReceived=0 UNIFIpacketsSent=1 UNIFIbytesReceived=0 UNIFIbytesSent=54 UNIFIflowCount=1 UNIFIflowId=null UNIFIflowStartTime=Jun 24, 2026 at 3:22:03.532 PM UNIFIipsSessionId=1316644713078973 UNIFIipsSignature=ET DROP Dshield Block Listed Source group 1 UNIFIipsSignatureId=2402000 UNIFIutcTime=2026-06-24T20:22:05.002Z msg=A network intrusion attempt from 45.194.67.146 to 192.168.1.194 has been detected and blocked.",
      "expect": {
        "host": "UCG-Max",
        "action": "blocked",
        "dest_ip": "192.168.1.194",
        "message": "A network intrusion attempt from 45.194.67.146 to 192.168.1.194 has been detected and blocked.",
        "service": "HTTPS",
        "dest_port": "443",
        "rule_name": "DShield Block List",
        "source_ip": "45.194.67.146",
        "source_port": "37383",
        "signature_id": "2402000",
        "event_outcome": "blocked",
        "signature_name": "ET DROP Dshield Block Listed Source group 1",
        "network_protocol": "TCP"
      }
    },
    {
      "description": "Header-stripped CEF line (after ingest tag guard) still matches",
      "input": "CEF:0|Ubiquiti|UniFi Network|10.4.57|201|Threat Detected and Blocked|7|UNIFIcategory=Security UNIFIhost=UCG Max proto=TCP spt=37383 dpt=443 act=blocked app=HTTPS UNIFIrisk=medium UNIFIpolicyName=DShield Block List UNIFIpolicyType=IDS/IPS UNIFIdirection=incoming deviceOutboundInterface=Default UNIFIdeviceMac=28:70:4e:84:bc:d5 UNIFIdeviceName=UCG Max UNIFIdeviceModel=UCG-Max UNIFIdeviceIp=192.168.1.1 UNIFIdeviceVersion=5.1.19 src=45.194.67.146 dst=192.168.1.194 UNIFIsrcRegion=BR UNIFIdstZone=Internal UNIFItotalBytes=54 UNIFItotalPackets=1 UNIFIpacketsReceived=0 UNIFIpacketsSent=1 UNIFIbytesReceived=0 UNIFIbytesSent=54 UNIFIflowCount=1 UNIFIflowId=null UNIFIflowStartTime=Jun 24, 2026 at 3:22:03.532 PM UNIFIipsSessionId=1316644713078973 UNIFIipsSignature=ET DROP Dshield Block Listed Source group 1 UNIFIipsSignatureId=2402000 UNIFIutcTime=2026-06-24T20:22:05.002Z msg=A network intrusion attempt from 45.194.67.146 to 192.168.1.194 has been detected and blocked.",
      "expect": {
        "action": "blocked",
        "dest_ip": "192.168.1.194",
        "message": "A network intrusion attempt from 45.194.67.146 to 192.168.1.194 has been detected and blocked.",
        "service": "HTTPS",
        "dest_port": "443",
        "rule_name": "DShield Block List",
        "source_ip": "45.194.67.146",
        "source_port": "37383",
        "signature_id": "2402000",
        "event_outcome": "blocked",
        "signature_name": "ET DROP Dshield Block Listed Source group 1",
        "network_protocol": "TCP"
      }
    }
  ]
}
