{
  "schema": "siembox.parser/v1",
  "name": "linux-sudo",
  "description": "Parses sudo command execution logs. The syslog header is optional so both header-stripped messages and full embedded lines match.",
  "parser_type": "regex",
  "priority": 15,
  "pattern": "^(?:(?<timestamp>\\w{3} {1,2}\\d{1,2} \\d{2}:\\d{2}:\\d{2}) (?<hostname>\\S{1,255}) sudo: +)?(?<user>[^ :]{1,64}) +: +TTY=(?<tty>\\S{1,64}) +; +PWD=(?<pwd>\\S{1,255}) +; +USER=(?<target_user>\\S{1,64}) +; +COMMAND=(?<command>.+)$",
  "field_mappings": {
    "timestamp": "timestamp",
    "hostname": "hostname",
    "user": "user",
    "tty": "tty",
    "working_dir": "pwd",
    "target_user": "target_user",
    "command": "command"
  },
  "event_type": "sudo_command",
  "enabled": true,
  "test_samples": [
    {
      "description": "sudo invocation captures the invoking user, target user, and command",
      "input": "Jan 15 12:00:00 webserver sudo:    alice : TTY=pts/0 ; PWD=/home/alice ; USER=root ; COMMAND=/usr/bin/apt update",
      "expect": {
        "user": "alice",
        "target_user": "root",
        "command": "/usr/bin/apt update",
        "host": "webserver",
        "service": "sudo"
      }
    },
    {
      "description": "Header-stripped message (tag removed at ingest) still matches",
      "input": "alice : TTY=pts/0 ; PWD=/home/alice ; USER=root ; COMMAND=/usr/bin/apt update",
      "expect": {
        "user": "alice",
        "target_user": "root",
        "command": "/usr/bin/apt update",
        "service": "sudo"
      }
    }
  ],
  "metadata": {
    "author": "siembox",
    "log_source": "Linux sudo (syslog auth.log / journald)",
    "tags": [
      "sudo",
      "privilege-escalation",
      "linux"
    ],
    "references": [
      "https://www.sudo.ws/docs/man/sudo.man/#LOG_FORMAT"
    ]
  }
}
